Url,Name,Price,Shop_url
https://tiki.vn/set-do-bo-nu-thoi-trang-p68119208.html?spid=68308367,Sét Đồ Bộ Nữ Thời Trang,143.100₫,https://tiki.vn/cua-hang/thoi-trang-tina?source_screen=product_detail&source_engine=organic
https://tiki.vn/set-do-nu-bo-quan-ao-nu-thu-dong-ao-dai-tay-quan-short-2-mau-nau-den-in-chu-phong-cach-ca-tinh-p128125492.html?spid=128125494,"set đồ nữ, bộ quần áo nữ thu đông áo dài tay, quần short 2 màu nâu, đen in chữ phong cách cá tính",99.000₫,https://tiki.vn/cua-hang/jelly?source_screen=product_detail&source_engine=organic
https://tiki.vn/set-bo-do-nu-3-mon-voi-tone-mau-hong-don-gian-xinh-xan-set-so-mi-3-mon-di-bien-ao-so-mi-quan-dui-chat-cotton-kem-ao-p274506835.html?spid=274506837,"Set bộ đồ nữ 3 món với tone màu hồng đơn giản xinh xắn, Sét sơ mi 3 món đi biển, áo sơ mi + quần đùi chất cotton kèm áo,",175.000₫,https://tiki.vn/cua-hang/jinshopteen?source_screen=product_detail&source_engine=organic
https://tiki.vn/jumpsui-ngan-nu-tinh-kieu-jumpsuit-co-dap-cheo-phoi-phu-kien-goti-3182-p50246066.html?spid=50246070,Jumpsui Ngắn Nữ Tính Kiểu Jumpsuit Cổ Đắp Chéo Phối Phụ Kiện GOTI 3182,228.000₫,https://tiki.vn/cua-hang/goti?source_screen=product_detail&source_engine=organic
https://tiki.vn/set-bo-nu-cong-so-luperi-lfsb499-ao-coc-tay-phoi-dai-ket-hop-quan-dai-p191928018.html?spid=191928020,Sét Bộ Nữ Công Sở LUPERI LFSB499 Áo Cộc Tay Phối Đai Kết Hợp Quần Dài,1.050.000₫,https://tiki.vn/cua-hang/luperi?source_screen=product_detail&source_engine=organic
https://tiki.vn/set-bo-dui-mac-nha-danh-cho-nu-do-bo-thun-cotton-mac-nha-duihoa-p196898280.html?spid=271118577,"Set bộ đùi mặc nhà dành cho nữ, đồ bộ thun cotton mặc nhà-DUIHOA",230.000₫,https://tiki.vn/cua-hang/new-sky-shop-18?source_screen=product_detail&source_engine=organic
https://tiki.vn/bo-do-the-thao-nu-phoi-mau-tt379-p56244246.html?spid=56659146,Bộ đồ thể thao nữ phối màu TT379,195.000₫,https://tiki.vn/cua-hang/thoi-trang-tina?source_screen=product_detail&source_engine=organic
https://tiki.vn/set-ao-cai-nut-tui-gia-kem-chan-vay-co-lot-quan-2-mau-y-hinh-p272302857.html?spid=272302861,SÉT ÁO CÀI NÚT TÚI GIẢ KÈM CHÂN VÁY CÓ LÓT QUẦN 2 MÀU Y HÌNH,145.000₫,https://tiki.vn/cua-hang/huong-nemo-style?source_screen=product_detail&source_engine=organic
https://tiki.vn/set-ao-gam-co-yem-kem-quan-ong-rong-4-mau-y-hinh-p274186607.html?spid=274186616,SÉT ÁO GẤM CỔ YẾM KÈM QUẦN ỐNG RỘNG 4 MÀU Y HÌNH,185.000₫,https://tiki.vn/cua-hang/huong-nemo-style?source_screen=product_detail&source_engine=organic
https://tiki.vn/bo-quan-ao-xep-ly-p14837823.html?spid=14837827,Bộ Quần Áo Xếp Ly,172.000₫,https://tiki.vn/cua-hang/thoi-trang-boboshop?source_screen=product_detail&source_engine=organic
https://tiki.vn/do-bo-thun-nu-bigsize-quan-dai-bo-gau-ao-from-rong-theu-hinh-non-set-bo-di-choi-do-bo-mac-nha-bao-dep-cao-cap-p253038426.html?spid=253038432,"Đồ bộ thun nữ bigsize quần dài bo gấu áo from rộng thêu hình nón, sét bộ đi chơi, đô bộ mặc nhà bao đẹp cao cấp",299.000₫,https://tiki.vn/cua-hang/thoi-trang-tina?source_screen=product_detail&source_engine=organic
https://tiki.vn/set-bo-quan-ao-the-thao-sieu-thoi-trang-p87094605.html?spid=102109551,Set bộ quần áo thể thao siêu thời trang,135.000₫,https://tiki.vn/cua-hang/xuong-quan-ao-dep?source_screen=product_detail&source_engine=organic
https://tiki.vn/set-ao-quan-jean-xanh-ngado-p273950102.html?spid=273953229,Set áo quần jean xanh NGADO,950.000₫,https://tiki.vn/cua-hang/ngado?source_screen=product_detail&source_engine=organic
https://tiki.vn/set-ao-tam-lanh-theu-kem-vay-cotton-lanh-co-quan-trong-2-mau-y-hinh-p275280098.html?spid=275280100,SET ÁO TĂM LẠNH THÊU KÈM VÁY COTTON LẠNH (CÓ QUẦN TRONG) 2 MÀU Y HÌNH,175.000₫,https://tiki.vn/cua-hang/huong-nemo-style?source_screen=product_detail&source_engine=organic
https://tiki.vn/set-bo-do-nu-ao-yem-tay-bong-vai-to-kem-quan-short-dui-nu-ca-tinh-p230221001.html?spid=230221003,Set bộ đồ nữ áo yếm tay bồng vải tơ kèm quần short đùi nữ cá tính,155.000₫,https://tiki.vn/cua-hang/maymay?source_screen=product_detail&source_engine=organic
https://tiki.vn/bo-quan-ao-giu-nhiet-nu-chat-len-tam-co-tron-quan-ao-giu-nhiet-nu-p205712664.html?spid=205712734,Bộ quần áo giữ nhiệt nữ chất len tăm cổ tròn - quan ao giu nhiet nu,99.000₫,https://tiki.vn/cua-hang/wecan?source_screen=product_detail&source_engine=organic
https://tiki.vn/bo-do-quan-ao-cho-ba-cho-me-lich-su-ab11-hang-quang-chau-cao-cap-p195664883.html?spid=195664891,Bộ Đồ Quần Áo Cho Bà Cho Mẹ Lịch Sự AB11 - Hàng Quảng Châu Cao Cấp,298.000₫,https://tiki.vn/cua-hang/avashop-thoi-trang?source_screen=product_detail&source_engine=organic
https://tiki.vn/set-quan-short-ao-phong-like-ullzang-anh-that-co-san-p189557521.html?spid=189557555,Set Quần Short + Áo Phông Like Ullzang (Ảnh thật/Có Sẵn),178.000₫,https://tiki.vn/cua-hang/thoitrangtp?source_screen=product_detail&source_engine=organic
https://tiki.vn/do-bo-nu-tay-lo-phoi-hoa-tiet-khoa-keo-co-sang-trong-p177271687.html?spid=177271728,Đồ bộ nữ tay lỡ phối họa tiết khóa kéo cổ sang trọng,245.000₫,https://tiki.vn/cua-hang/thoi-trang-tina?source_screen=product_detail&source_engine=organic
https://tiki.vn/set-bo-quan-lung-do-bo-nam-nu-unisex-bo-sua-moo-hoat-hinh-cao-cap-dubati-fashion-p189942060.html?spid=189942147,SÉT BỘ QUẦN LỬNG ĐỒ BỘ NAM NỮ UNISEX BÒ SỮA MOO HOẠT HÌNH CAO CẤP - FASHION,96.000₫,https://tiki.vn/cua-hang/thoitrangthienphucunisex?source_screen=product_detail&source_engine=organic
https://tiki.vn/jumpsuit-ao-lien-quan-lua-co-tron-tay-ngan-sang-trong-p109224752.html?spid=109224758,Jumpsuit (Áo Liền Quần) Lụa Cổ Tròn Tay Ngắn Sang Trọng,199.000₫,https://tiki.vn/cua-hang/khanh-linh-style?source_screen=product_detail&source_engine=organic
https://tiki.vn/set-bo-kaki-quan-ong-rong-kem-ao-ba-lo-2-lop-3-mau-y-hinh-p271479408.html?spid=271479414,SÉT BỘ KAKI QUẦN ỐNG RỘNG KÈM ÁO BA LỖ 2 LỚP 3 MÀU Y HÌNH,165.000₫,https://tiki.vn/cua-hang/huong-nemo-style?source_screen=product_detail&source_engine=organic
https://tiki.vn/set-bo-do-nu-co-be-in-hoa-tiet-chu-mau-thoi-trang-tre-trung-p176801844.html?spid=176801849,Sét bộ đồ nữ cổ bể in họa tiết chữ màu thời trang trẻ trung,239.000₫,https://tiki.vn/cua-hang/thoi-trang-tina?source_screen=product_detail&source_engine=organic
https://tiki.vn/bo-so-mi-nu-trang-form-rong-va-quan-dui-tre-trung-thoi-trang-mua-xuan-he-cho-nu-dui-viet-p271940039.html?spid=271940142,Bộ sơ mi nữ trắng form rộng và quần đùi trẻ trung thời trang mùa xuân hè cho nữ Đũi Việt,319.000₫,https://tiki.vn/cua-hang/dui-viet?source_screen=product_detail&source_engine=organic
https://tiki.vn/set-do-nu-bo-quan-ao-nu-thu-dong-ao-dai-tay-quan-short-2-mau-p130452631.html?spid=130452635,"set đồ nữ, bộ quần áo nữ thu đông áo dài tay, quần short 2 màu",140.000₫,https://tiki.vn/cua-hang/suzyvi?source_screen=product_detail&source_engine=organic
https://tiki.vn/do-bo-nu-vien-ren-sieu-xinh-p64450580.html?spid=64450595,Đồ bộ nữ viền ren siêu xinh,149.000₫,https://tiki.vn/cua-hang/thoi-trang-tina?source_screen=product_detail&source_engine=organic
https://tiki.vn/set-ao-so-mi-quan-short-ong-rong-nu-chat-lieu-linen-sieu-mat-set-mau-be-ton-da-khong-ken-dang-bv05-p275809681.html?spid=275809689,"Set áo sơ mi + quần short ống rộng nữ chất liệu Linen siêu mát, set màu be tôn da không kén dáng BV05",400.000₫,https://tiki.vn/cua-hang/nh-fashion?source_screen=product_detail&source_engine=organic
https://tiki.vn/bo-ao-sat-nach-va-quan-ong-rong-chat-linen-thoang-mat-phoi-hoa-tiet-khuy-gia-canh-suon-bv07-p275130591.html?spid=275130603,Bộ áo sát nách và quần ống rộng chất linen thoáng mát phối họa tiết khuy giả cạnh sườn BV07,638.000₫,https://tiki.vn/cua-hang/dui-viet?source_screen=product_detail&source_engine=organic
https://tiki.vn/set-dui-ao-so-mi-voan-cao-cap-quan-co-tui-y-hinh-mau-y-hinh-p274998409.html?spid=274998410,SET ĐÙI ÁO SƠ MI VOAN CAO CẤP( QUẦN CÓ TÚI Y HÌNH MÀU Y HÌNH,195.000₫,https://tiki.vn/cua-hang/huong-nemo-style?source_screen=product_detail&source_engine=organic
https://tiki.vn/set-linh-nu-cao-cap-p56882190.html?spid=58655438,SÉT LÍNH NỮ CAO CẤP,224.000₫,https://tiki.vn/cua-hang/thoi-trang-tina?source_screen=product_detail&source_engine=organic
https://tiki.vn/set-do-nguyen-bo-dao-pho-thanh-lich-dang-set-ao-kem-phu-kien-vuong-quan-hoa-tiet-goti-3289s-p68776021.html?spid=68776039,Set Đồ Nguyên Bộ Dạo Phố Thanh Lịch Dạng Set Áo Kèm Phụ Kiện Vuông Quần Họa Tiết GOTI 3289S,290.000₫,https://tiki.vn/cua-hang/goti?source_screen=product_detail&source_engine=organic
https://tiki.vn/set-ao-beo-quan-dui-de-thuong-cho-nang-dao-pho-di-hoc-di-choi-zashopp-p170917735.html?spid=170917742,Set áo bèo quần đùi dễ thương cho nàng dạo phố đi học đi chơi,162.000₫,https://tiki.vn/cua-hang/monsshop?source_screen=product_detail&source_engine=organic
https://tiki.vn/quan-ao-dai-nu-ong-suong-chat-lieu-lua-my-cao-cap-p128523060.html?spid=128523208,Quần áo dài nữ ống suông chất liệu lụa mỹ cao cấp,100.000₫,https://tiki.vn/cua-hang/vest-va-ao-dai-xuan-shop?source_screen=product_detail&source_engine=organic
https://tiki.vn/set-quan-ong-rong-va-ao-peplum-sang-trong-p52506546.html?spid=52506552,Set quần ống rộng và áo peplum sang trọng,300.000₫,https://tiki.vn/cua-hang/thoi-trang-mymyshop?source_screen=product_detail&source_engine=organic
https://tiki.vn/set-ao-khoac-blazer-quan-dai-chat-linen-mau-hong-tre-trung-nu-tinh-thoi-trang-cong-so-haint-boutique-bv02-p272052822.html?spid=272052830,"Set áo khoác blazer + quần dài chất linen, màu hồng trẻ trung nữ tính, thời trang công sở Haint Boutique Bv02",546.000₫,https://tiki.vn/cua-hang/nh-fashion?source_screen=product_detail&source_engine=organic
https://tiki.vn/ao-jean-lien-quan-thoi-trang-p58373669.html?spid=58902869,Áo Jean Liền Quần Thời Trang,195.000₫,https://tiki.vn/cua-hang/thoi-trang-tina?source_screen=product_detail&source_engine=organic
https://tiki.vn/bo-do-the-thao-nu-phoi-soc-tt132-p54427832.html?spid=57286069,Bộ đồ thể thao nữ phối sọc TT132,219.000₫,https://tiki.vn/cua-hang/thoi-trang-tina?source_screen=product_detail&source_engine=organic
https://tiki.vn/set-vay-manggo-phoi-ren-co-lot-quan-kem-ao-khoac-va-ao-trong-tam-lanh-mau-y-hinh-p275016877.html?spid=275016878,SET VÁY MANGGO PHỐI REN( CÓ LÓT QUẦN) KÈM ÁO KHOÁC VÀ ÁO TRONG TĂM LẠNH MÀU Y HÌNH,175.000₫,https://tiki.vn/cua-hang/huong-nemo-style?source_screen=product_detail&source_engine=organic
https://tiki.vn/set-do-bo-dao-pho-quan-dai-kem-ao-co-kieu-nu-chat-thun-cat-han-day-dan-ton-dang-cuc-xinh-size-45-65kg-p158722271.html?spid=170980915,"┇☽Set đồ bộ dạo phố, quần dài kem áo cổ kiều nữ, chất thun cát hàn dày dặn, tôn dáng cực xinh, size 45-65kg",185.000₫,https://tiki.vn/cua-hang/new-sky-shop-18?source_screen=product_detail&source_engine=organic
https://tiki.vn/set-bo-cao-cap-quan-mango-ao-thun-gan-p271001133.html?spid=271001135,SÉT BỘ CAO CẤP QUẦN MANGO ÁO THUN GÂN,155.000₫,https://tiki.vn/cua-hang/huong-nemo-style?source_screen=product_detail&source_engine=organic
https://tiki.vn/bo-quan-ao-the-thao-nu-p55854595.html?spid=72283548,bộ quần áo thể thao nữ,86.000₫,https://tiki.vn/cua-hang/dam-yurin?source_screen=product_detail&source_engine=organic
https://tiki.vn/bo-do-thun-nu-bigsize-quan-ong-suong-dai-ao-tay-ngan-theu-hinh-gau-quang-chau-bao-dep-set-bo-di-choi-mac-nha-mau-moi-p253038503.html?spid=253038509,"Bộ đồ thun nữ bigsize quần ống suông dài áo tay ngắn thêu hình gấu quảng châu bao đẹp, sét bộ đi chơi, mặc nhà mẫu mới",299.000₫,https://tiki.vn/cua-hang/thoi-trang-tina?source_screen=product_detail&source_engine=organic
https://tiki.vn/do-bo-nu-phoi-hoa-tiet-logo-sieu-xinh-dep-p176801845.html?spid=176801858,Đồ bộ nữ phối họa tiết logo siêu xinh đẹp,219.000₫,https://tiki.vn/cua-hang/thoi-trang-tina?source_screen=product_detail&source_engine=organic
https://tiki.vn/set-bo-ao-babydoll-vat-cao-thap-co-tron-va-quan-ngan-p181656793.html?spid=181656804,Sét bộ áo babydoll vạt cao thấp cổ tròn và quần ngắn,135.000₫,https://tiki.vn/cua-hang/monsshop?source_screen=product_detail&source_engine=organic
https://tiki.vn/quan-ao-dai-nu-ong-suong-chat-lieu-phi-bong-p107443703.html?spid=107443751,Quần áo dài nữ ống suông chất liệu phi bóng,70.000₫,https://tiki.vn/cua-hang/vest-va-ao-dai-xuan-shop?source_screen=product_detail&source_engine=organic
https://tiki.vn/set-ao-2-day-cach-dieu-nhun-quan-vay-bo-chun-p83604104.html?spid=83604108,Sét áo 2 dây Cách điệu nhún +Quần váy Bo chun,264.000₫,https://tiki.vn/cua-hang/may-dam-thiet-ke?source_screen=product_detail&source_engine=organic
https://tiki.vn/set-quan-short-ao-phong-like-ullzang-anh-that-co-san-p144236496.html?spid=144236626,"Set Quần Short + Áo Phông Like Ullzang (Ảnh thật/Có Sẵn), Bộ Short Đùi - Set bộ áo và quần short dưới 65kg tabistore - I LIKE, Đồ Bộ Mặc Nhà Dạo Phố Chất Thun Cotton I LIKE Tay Phối Raplang Trẻ Trung Năng Động",102.000₫,https://tiki.vn/cua-hang/dam-yurin?source_screen=product_detail&source_engine=organic
https://tiki.vn/set-ao-thun-unisex-quan-short-thun-cotton-hoa-tiet-sieu-hot-freesize-50-80kg-p145672024.html?spid=213857756,SET ÁO THUN NỮ + QUẦN SHORT THUN - COTTON - HỌA TIẾT SIÊU HOT - FREESIZE (50-80kg),95.000₫,https://tiki.vn/cua-hang/bui-store?source_screen=product_detail&source_engine=organic
https://tiki.vn/set-ao-2-day-xep-beo-va-chan-vay-sieu-nu-tinh-p85175170.html?spid=100161058,Set áo 2 dây xếp bèo và chân váy siêu nữ tính,269.000₫,https://tiki.vn/cua-hang/xuong-quan-ao-dep?source_screen=product_detail&source_engine=organic
https://tiki.vn/set-bo-quan-dui-ao-so-mi-ke-soc-xinh-xan-p177272073.html?spid=177272086,Sét bộ quần đùi áo sơ mi kẻ sọc xinh xắn,139.000₫,https://tiki.vn/cua-hang/thoi-trang-tina?source_screen=product_detail&source_engine=organic
https://tiki.vn/set-ao-so-mi-va-quan-short-mau-tim-pastel-nhe-nhang-diu-dang-phong-cach-han-quoc-thich-hop-di-choi-di-bien-di-lam-chat-linen-bot-cao-cap-p275166622.html?spid=275166626,"Set áo sơ mi và quần short màu tím pastel nhẹ nhàng, dịu dàng, phong cách Hàn Quốc thích họp đi chơi, đi biển, đi làm, chất linen bột cao cấp",319.000₫,https://tiki.vn/cua-hang/hainguyenshop?source_screen=product_detail&source_engine=organic
https://tiki.vn/bo-quan-ao-nu-form-rong-in-hoa-cao-cap-co-bigsize-mau-moi-gia-re-dep-do-bo-mac-di-choi-mac-o-nha-xinh-xan-p249372855.html?spid=249372868,"Bộ quần áo nữ form rộng in hoa cao cấp có bigsize mẫu mới giá rẻ đẹp, đô bộ mặc đi chơi mặc ơ nhà xinh xắn",229.000₫,https://tiki.vn/cua-hang/thoi-trang-tina?source_screen=product_detail&source_engine=organic
https://tiki.vn/set-do-bo-nu-quan-caro-phoi-ao-co-tim-thun-cotton-mat-min-p64636058.html?spid=64636084,Sét đồ bộ nữ quần caro phối áo cổ tim thun cotton mát mịn,89.100₫,https://tiki.vn/cua-hang/thoi-trang-tina?source_screen=product_detail&source_engine=organic
https://tiki.vn/set-do-bo-nu-tay-dai-ao-kieu-co-so-mi-kem-quan-coc-phoi-tui-xinh-cho-nang-dao-pho-di-choi-di-tiec-p197953007.html?spid=197953013,"Sét đồ bộ nữ tay dài áo kiểu cổ sơ mi kèm quần cộc phối túi xinh cho nàng dạo phố,đi chơi,đi tiệc",150.000₫,https://tiki.vn/cua-hang/monsshop?source_screen=product_detail&source_engine=organic
https://tiki.vn/set-bo-dui-nu-phoi-khoa-keo-set-bo-dao-pho-do-mac-nha-xinh-xan-size-tu-40-70kg-p88042715.html?spid=88042724,Sét bộ đùi nữ phối khóa kéo - sét bộ dạo phố đồ mặc nhà xinh xắn size từ 40-70kg,139.000₫,https://tiki.vn/cua-hang/thoi-trang-tina?source_screen=product_detail&source_engine=organic
https://tiki.vn/set-bo-quan-short-kaki-ao-thun-hit-hot-vn01-p54344899.html?spid=56844402,SET BỘ QUẦN SHORT KAKI ÁO THUN HIT HOT - VN01,174.600₫,https://tiki.vn/cua-hang/thoi-trang-tina?source_screen=product_detail&source_engine=organic
https://tiki.vn/set-bo-ao-dai-tay-ni-tam-co-tron-tron-kem-quan-cutlottes-ong-xuong-phong-cach-nang-dong-set-bo-thu-dong-sieu-hot-p272444206.html?spid=272444208,"Sét Bộ Áo Dài Tay NỈ TĂM Cổ Tròn Trơn Kèm Quần Cutlottes Ống Xuông Phong Cách Năng Động , Sét Bộ Thu Đông Siêu Hot",115.000₫,https://tiki.vn/cua-hang/huong-nemo-style?source_screen=product_detail&source_engine=organic
https://tiki.vn/set-bo-gom-ao-so-mi-dai-tay-va-quan-ong-rong-chat-linen-thoi-trang-thoang-mat-phong-cach-han-quoc-de-mac-p275163682.html?spid=275163686,"Set bộ gồm áo sơ mi dài tay và quần ống rộng chất linen thời trang, thoáng mát, phong cách Hàn Quốc dễ mặc",455.000₫,https://tiki.vn/cua-hang/hainguyenshop?source_screen=product_detail&source_engine=organic
https://tiki.vn/set-bo-ao-gan-quan-kaki-sieu-xinh-2-mau-y-hinh-p271078020.html?spid=271078022,SÉT BỘ ÁO GÂN QUẦN KAKI SIÊU XINH 2 MÀU Y HÌNH,165.000₫,https://tiki.vn/cua-hang/huong-nemo-style?source_screen=product_detail&source_engine=organic
https://tiki.vn/set-do-nu-chat-dui-bo-do-nu-he-ao-yem-quan-dui-chat-dui-xinh-xa-n-p117573855.html?spid=117573861,"set đồ nữ chất đũi,bộ đồ nữ hè áo yếm quần đùi chât đũi xinh xắn",99.000₫,https://tiki.vn/cua-hang/cua-hang-linh-linh?source_screen=product_detail&source_engine=organic
https://tiki.vn/set-bo-do-nu-tre-trung-cao-cap-mau-moi-dep-bao-chat-bo-do-the-thao-di-choi-mac-o-nha-xinh-xan-p249372873.html?spid=249372879,"Sét bộ đồ nữ trẻ trung cao cấp mẫu mới đẹp bao chất, bộ đồ thể thao đi chơi mặc ơ nhà xinh xắn",199.000₫,https://tiki.vn/cua-hang/thoi-trang-tina?source_screen=product_detail&source_engine=organic
https://tiki.vn/bo-quan-ao-thun-meyrr-coc-tay-set-ao-phong-quan-dui-dang-rong-2-mau-p181118329.html?spid=189957451,"Bộ Quần Áo Thun MEYRR Cộc Tay, Set Áo Phông Quần Đùi Dáng Rộng 2 Màu",108.000₫,https://tiki.vn/cua-hang/thoitrangthienphucunisex?source_screen=product_detail&source_engine=organic
https://tiki.vn/set-bo-quan-ao-gau-hot-trend-chat-thun-mem-min-p187853540.html?spid=187853567,Sét Bộ Quần Áo Gấu Hot Trend Chất Thun Mềm Mịn,99.000₫,https://tiki.vn/cua-hang/jins-store?source_screen=product_detail&source_engine=organic
https://tiki.vn/quan-ao-giu-nhiet-cho-nu-bo-giu-am-ben-trong-p75327164.html?spid=75327168,Quần áo giữ nhiệt cho nữ bộ giữ ấm bên trong,495.000₫,https://tiki.vn/cua-hang/mai-am-store?source_screen=product_detail&source_engine=organic
https://tiki.vn/set-do-nu-in-chu-han-sieu-xinh-chat-vai-mem-thoang-mat-mac-cuc-thoai-mai-wedo-p178585235.html?spid=178585303,SET ĐỒ NỮ IN CHỮ HÀN SIÊU XINH CHẤT VẢI MỀM THOÁNG MÁT MẶC CỰC THOẢI MÁI,102.000₫,https://tiki.vn/cua-hang/thoitrangunisextp?source_screen=product_detail&source_engine=organic
https://tiki.vn/set-bo-linh-ao-ke-soc-va-quan-kaki-tui-nap-p56087617.html?spid=56844404,SET BỘ LÍNH ÁO KẺ SỌC VÀ QUẦN KAKI TÚI NẮP,197.100₫,https://tiki.vn/cua-hang/thoi-trang-tina?source_screen=product_detail&source_engine=organic
https://tiki.vn/set-bo-thanh-lich-kieu-set-ao-kieu-phoi-quan-ong-rong-goti-3134-p50246710.html?spid=50246714,Set Bộ Thanh Lịch Kiểu Set Áo Kiểu Phối Quần Ống Rộng GOTI 3134,319.000₫,https://tiki.vn/cua-hang/goti?source_screen=product_detail&source_engine=organic
https://tiki.vn/do-lam-di-chua-thun-lac-dong-tien-do-bo-quan-ao-nu-do-trung-nien-p118027805.html?spid=118034987,Đồ Lam Đi Chùa # Thun Lắc Đồng Tiền # Đồ Bộ # Quần Áo Nữ # Đồ Trung Niên,186.000₫,https://tiki.vn/cua-hang/xuong-may-9x?source_screen=product_detail&source_engine=organic
https://tiki.vn/quan-ao-do-bo-nu-xinh-chat-kate-p207363263.html?spid=207363292,quần áo đồ bộ nữ xinh chất kate,190.000₫,https://tiki.vn/cua-hang/do-bo-eirlys-shop?source_screen=product_detail&source_engine=organic
https://tiki.vn/set-do-bo-nu-quan-dai-ao-thun-lanh-form-rong-in-3d-hoa-tiet-sang-trong-thanh-lich-mau-moi-dep-co-bigsize-p253038871.html?spid=253038873,Sét đồ bộ nữ quần dài áo thun lạnh form rộng in 3D họa tiết sang trọng thanh lịch mẫu mới đẹp có bigsize,239.200₫,https://tiki.vn/cua-hang/thoi-trang-tina?source_screen=product_detail&source_engine=organic
https://tiki.vn/set-do-nu-sang-chanh-bo-do-nu-ao-so-mi-dai-day-eo-kem-quan-goi-cam-p162844630.html?spid=162844632,"set đồ nữ sang chảnh, bộ đồ nữ áo sơ mi dài dây eo kèm quần sang chảnh",95.000₫,https://tiki.vn/cua-hang/jelly?source_screen=product_detail&source_engine=organic
https://tiki.vn/bo-ao-quan-ke-caro-chat-tho-dui-thiet-ke-tay-ngan-quan-lung-form-dang-tre-trung-haint-boutique-p262806318.html?spid=262806330,Bộ áo quần kẻ caro chất thô đũi thiết kế tay ngắn quần lửng form dáng trẻ trung Haint Boutique,227.000₫,https://tiki.vn/cua-hang/nh-fashion?source_screen=product_detail&source_engine=organic
https://tiki.vn/quan-ao-nu-mac-nha-chat-kate-p206542037.html?spid=206542105,quần áo nữ mặc nhà chất kate,190.000₫,https://tiki.vn/cua-hang/do-bo-eirlys-shop?source_screen=product_detail&source_engine=organic
https://tiki.vn/jumpsuit-dang-dai-phoi-co-vuong-sang-chanh-ao-lien-quan-ong-rong-ca-tinh-thich-hop-du-tiec-cong-so-hay-dao-pho-p253627732.html?spid=253627740,"Jumpsuit dáng dài phối cổ vuông sang chảnh-áo liền quần ống rộng cá tính thích hợp dự tiệc, công sở hay dạo phố",220.000₫,https://tiki.vn/cua-hang/thoi-trang-mymyshop?source_screen=product_detail&source_engine=organic
https://tiki.vn/set-the-thao-nu-p54006376.html?spid=64433912,Set Thể Thao Nữ,310.000₫,https://tiki.vn/cua-hang/thoi-trang-tina?source_screen=product_detail&source_engine=organic
https://tiki.vn/set-do-bo-thun-nu-quan-dai-bo-gau-ao-form-rong-theu-logo-bo-do-the-thao-di-choi-mac-nha-cuc-chat-mau-moi-dep-co-bigsize-p259483671.html?spid=259483696,"Sét đồ bộ thun nữ quần dài bo gấu áo form rộng thêu logo, bộ đồ thể thao đi chơi mặc nhà cực chất mẫu mới đẹp có bigsize",239.000₫,https://tiki.vn/cua-hang/thoi-trang-tina?source_screen=product_detail&source_engine=organic
https://tiki.vn/jumpsuit-nu-tinh-kieu-jumpsuit-dai-hoa-tiet-goti-3179-p49098032.html?spid=49098036,Jumpsuit nữ tính kiểu jumpsuit dài họa tiết GOTI 3179,299.000₫,https://tiki.vn/cua-hang/goti?source_screen=product_detail&source_engine=organic
https://tiki.vn/set-do-nu-sang-chanh-bo-do-nu-ao-so-mi-dai-day-eo-kem-quan-2-mau-tre-trung-p181714001.html?spid=181714003,"set đồ nữ sang chảnh, bộ đồ nữ áo sơ mi dài dây eo kèm quần 2 màu trẻ trung",89.000₫,https://tiki.vn/cua-hang/suzyvi?source_screen=product_detail&source_engine=organic
https://tiki.vn/set-ao-tam-lanh-kem-quan-lennin-5-mau-y-hinh-p274545898.html?spid=274545906,SÉT ÁO TĂM LẠNH KÈM QUẦN LENNIN 5 MÀU Y HÌNH,155.000₫,https://tiki.vn/cua-hang/huong-nemo-style?source_screen=product_detail&source_engine=organic
https://tiki.vn/set-quan-short-ao-phong-maybe-june-1993-ullzang-anh-that-co-san-p195707983.html?spid=195707999,Set Quần Short + Áo Phông Maybe June 1993 Ullzang (Ảnh thật/Có Sẵn),98.000₫,https://tiki.vn/cua-hang/thoitrangtp?source_screen=product_detail&source_engine=organic
https://tiki.vn/do-bo-nu-quan-ong-suong-ao-so-mi-2-tui-sang-trong-p177272170.html?spid=177272175,Đồ bộ nữ quần ống suông áo sơ mi 2 túi sang trọng,148.500₫,https://tiki.vn/cua-hang/thoi-trang-tina?source_screen=product_detail&source_engine=organic
https://tiki.vn/set-ao-thun-va-quan-lung-tui-nap-kaki-ran-ri-size-45kg-den-68kg-p52043793.html?spid=56829263,SET ÁO THUN VÀ QUẦN LỬNG TÚI NẮP KAKI RẰN RI SIZE 45KG ĐẾN 68KG,219.600₫,https://tiki.vn/cua-hang/thoi-trang-tina?source_screen=product_detail&source_engine=organic
https://tiki.vn/ao-thun-nu-a-o-phong-nu-coc-tay-phoi-mau-in-so-11-dang-rong-giau-quan-nang-dong-p115832954.html?spid=115832960,"áo thun nữ,áo phông nữ cộc tay phối màu in số 11 dáng rộng giấu quần năng động",63.000₫,https://tiki.vn/cua-hang/jelly?source_screen=product_detail&source_engine=organic
https://tiki.vn/jum-nu-dinh-kim-tuyen-cot-no-thoi-trang-p76201236.html?spid=76201242,Jum nữ đính kim tuyến cột nơ thời trang,182.000₫,https://tiki.vn/cua-hang/xuong-quan-ao-dep?source_screen=product_detail&source_engine=organic
https://tiki.vn/set-ao-phoi-co-phoi-tay-kem-chan-vay-co-quan-day-keo-sau-mau-y-hinh-p275245413.html?spid=275245414,SET ÁO PHỐI CỔ PHỐI TAY KÈM CHÂN VÁY CÓ QUẦN DÂY KÉO SAU MÀU Y HÌNH,185.000₫,https://tiki.vn/cua-hang/huong-nemo-style?source_screen=product_detail&source_engine=organic
https://tiki.vn/set-bo-dui-ao-lua-y-in-hoa-kem-quan-cotton-lanh-mau-y-hinh-p270436556.html?spid=270436558,SET BỘ ĐÙI ÁO LỤA Ý IN HOA KÈM QUẦN COTTON LẠNH MÀU Y HÌNH,145.000₫,https://tiki.vn/cua-hang/huong-nemo-style?source_screen=product_detail&source_engine=organic
