Url,Name,Price,Shop_url
https://tiki.vn/set-bo-do-nu-ao-yem-kem-quan-dui-vai-to-nhieu-mau-hottrend-p230231172.html?spid=230231184,Set bộ đồ nữ áo yếm kèm quần đùi vải tơ nhiều màu hottrend,99.000₫,https://tiki.vn/cua-hang/maymay?source_screen=product_detail&source_engine=organic
https://tiki.vn/set-bo-do-quan-dui-nu-in-chu-sdbudn-do-mac-nha-do-nu-do-ngu-kem-anh-that-p207492160.html?spid=207661404,"Sét bộ đồ quần đùi nữ in chữ SDBUDN, đồ mặc nhà, đồ nữ, đồ ngủ (kèm ảnh thật)",92.000₫,https://tiki.vn/cua-hang/thoitrangthienphucunisex?source_screen=product_detail&source_engine=organic
https://tiki.vn/set-quan-ong-rong-kem-ao-2-day-xe-ta-mau-y-hinh-p270508233.html?spid=270508235,SÉT QUẦN ỐNG RỘNG KÈM ÁO 2 DÂY XẺ TÀ MÀU Y HÌNH,155.000₫,https://tiki.vn/cua-hang/huong-nemo-style?source_screen=product_detail&source_engine=organic
https://tiki.vn/bo-do-nu-quan-dui-ngan-ao-thun-cotton-100-form-rong-theu-hinh-gau-bo-do-the-thao-di-choi-bo-do-mac-o-nha-sieu-xinh-p259497371.html?spid=259497400,"Bộ đồ nữ quần đùi ngắn áo thun cotton 100% form rộng thêu hình gấu, bộ đồ thể thao đi chơi, bộ đồ mặc ở nhà siêu xinh",210.000₫,https://tiki.vn/cua-hang/thoi-trang-tina?source_screen=product_detail&source_engine=organic
https://tiki.vn/set-quan-va-ao-khoac-kaki-cao-cap-tk118-p23574409.html?spid=67173570,Sét quần và áo khoác kaki cao cấp TK118,354.000₫,https://tiki.vn/cua-hang/thoi-trang-tina?source_screen=product_detail&source_engine=organic
https://tiki.vn/set-bo-quan-kaki-tui-hop-kem-ao-thun-co-tru-theu-mau-y-hinh-p271237866.html?spid=271237868,SÉT BỘ QUẦN KAKI TÚI HỘP KÈM ÁO THUN CỔ TRỤ THÊU MÀU Y HÌNH,175.000₫,https://tiki.vn/cua-hang/huong-nemo-style?source_screen=product_detail&source_engine=organic
https://tiki.vn/set-do-bo-nu-quan-short-dui-va-ao-phong-xanh-coc-tay-sieu-xinh-thoi-trang-banamo-fashion-111-p152874901.html?spid=152874940,Set đồ bộ nữ quần short đũi và áo phông xanh cộc tay siêu xinh thời trang Banamo Fashion 111,75.000₫,https://tiki.vn/cua-hang/thoi-trang-banamo?source_screen=product_detail&source_engine=organic
https://tiki.vn/set-ao-quan-mac-nha-sieu-cute-p52322335.html?spid=52322359,SET ÁO + QUẦN MẶC NHÀ SIÊU CUTE,120.000₫,https://tiki.vn/cua-hang/thoi-trang-boboshop?source_screen=product_detail&source_engine=organic
https://tiki.vn/set-bo-nu-tinh-kieu-set-ao-phoi-hoa-tiet-cot-eo-quan-ong-rong-in-hoa-goti-3128-p43943041.html?spid=43943043,Set Bộ Nữ Tính Kiểu Set Áo Phối Họa Tiết Cột Eo Quần Ống Rộng In Hoa GOTI 3128,329.000₫,https://tiki.vn/cua-hang/goti?source_screen=product_detail&source_engine=organic
https://tiki.vn/combo-do-linh-3-in-1-ao-quan-khoac-cao-cap-p35245088.html?spid=56688291,COMBO ĐỒ LÍNH 3 IN 1 ÁO QUẦN KHOÁC CAO CẤP,341.550₫,https://tiki.vn/cua-hang/thoi-trang-tina?source_screen=product_detail&source_engine=organic
https://tiki.vn/set-bo-quan-tui-hop-bozip-phoi-kaki-ao-rut-day-2-ben-mau-y-hinh-p270955035.html?spid=270955037,SÉT BỘ QUẦN TÚI HỘP BOZIP PHỐI KAKI ÁO RÚT DÂY 2 BÊN MÀU Y HÌNH,145.000₫,https://tiki.vn/cua-hang/huong-nemo-style?source_screen=product_detail&source_engine=organic
https://tiki.vn/do-bo-nu-mac-nha-set-bo-tay-ngan-quan-lung-hoa-tiet-in-chu-sac-net-chat-thun-mem-de-thuong-mac-nha-thoai-mai-p168073468.html?spid=168073478,"Đồ Bộ Nữ Mặc Nhà, Set Bộ Tay Ngắn Quần Lửng Họa Tiết In Chữ Sắc Nét Chất Thun Mềm Dễ Thương Mặc Nhà Thoải Mái",163.900₫,https://tiki.vn/cua-hang/lolemboutique?source_screen=product_detail&source_engine=organic
https://tiki.vn/set-bo-gom-ao-so-mi-dai-tay-va-quan-dai-ong-rong-chat-linen-thoang-mat-thoai-mai-de-mac-phong-cach-han-quoc-p275163638.html?spid=275163642,"Set bộ gồm áo sơ mi dài tay và quần dài ống rộng chất linen thoáng mát, thoải mái, dễ mặc, phong cách Hàn Quốc",455.000₫,https://tiki.vn/cua-hang/hai-fashion?source_screen=product_detail&source_engine=organic
https://tiki.vn/set-bo-do-thun-nu-quan-dai-ao-form-rong-phoi-mau-tre-trung-thoi-trang-mau-moi-dep-cao-cap-co-bigsize-p259483511.html?spid=259483563,Sét bộ đồ thun nữ quần dài áo form rộng phối màu trẻ trung thời trang mẫu mới đẹp cao cấp có bigsize,228.735₫,https://tiki.vn/cua-hang/thoi-trang-tina?source_screen=product_detail&source_engine=organic
https://tiki.vn/set-bo-do-nu-ao-tay-phong-xep-ly-eo-phoi-quan-dui-sieu-xinh-da-dang-mau-sac-den-xanh-hong-nau-p171759602.html?spid=193891723,"Sét bộ đồ nữ áo tay phồng xếp ly eo phối quần đùi siêu xinh đa đạng màu sắc (Đen, Xanh, Hồng, Nâu).",111.200₫,https://tiki.vn/cua-hang/thoi-trang-tina?source_screen=product_detail&source_engine=organic
https://tiki.vn/set-bo-quan-tui-hop-cotton-lanh-ao-thun-tam-gan-mau-y-hinh-p270702215.html?spid=270702217,SÉT BỘ QUẦN TÚI HỘP COTTON LẠNH & ÁO THUN TĂM GÂN MÀU Y HÌNH,145.000₫,https://tiki.vn/cua-hang/huong-nemo-style?source_screen=product_detail&source_engine=organic
https://tiki.vn/ao-so-mi-nu-form-dai-che-quan-ca-tinh-sm013-mayhomes-p37975688.html?spid=37975696,Áo Sơ Mi Nữ Form Dài Che Quần Cá Tính SM013 MayHomes,128.900₫,https://tiki.vn/cua-hang/may-fashion?source_screen=product_detail&source_engine=organic
https://tiki.vn/jum-nu-dinh-kim-tuyen-cot-no-p76201243.html?spid=76201245,Jum nữ đính kim tuyến cột nơ,145.000₫,https://tiki.vn/cua-hang/huong-nemo-style?source_screen=product_detail&source_engine=organic
https://tiki.vn/set-bo-do-nu-di-bien-ao-croptop-buoc-no-eo-kem-quan-short-sang-chanh-p230239986.html?spid=230239988,Set bộ đồ nữ đi biển áo croptop buộc nơ eo kèm quần short sang chảnh,138.000₫,https://tiki.vn/cua-hang/maymay?source_screen=product_detail&source_engine=organic
https://tiki.vn/quan-ao-nu-mac-nha-chat-lua-han-p206542036.html?spid=206542104,quần áo nữ mặc nhà chất lụa hàn,180.000₫,https://tiki.vn/cua-hang/do-bo-eirlys-shop?source_screen=product_detail&source_engine=organic
https://tiki.vn/set-do-bo-the-thao-nu-co-tim-cao-cap-p68143039.html?spid=68143041,Sét đồ bộ thể thao nữ cổ tim cao cấp,199.000₫,https://tiki.vn/cua-hang/thoi-trang-tina?source_screen=product_detail&source_engine=organic
https://tiki.vn/set-ao-dai-nhung-kim-tuyen-y-hinh-kem-quan-tuyet-nhung-xin-xo-mau-y-hinh-p274054408.html?spid=274054410,SÉT ÁO DÀI NHUNG KIM TUYẾN Y HÌNH KÈM QUẦN TUYẾT NHUNG XỊN XÒ MÀU Y HÌNH,215.000₫,https://tiki.vn/cua-hang/huong-nemo-style?source_screen=product_detail&source_engine=organic
https://tiki.vn/set-bo-quan-ao-nam-nu-in-gau-erubrold-chat-vai-cotton-mem-mat-sieu-cute-wedo-p176416494.html?spid=176416538,"Set bộ quần áo nam nữ in gấu ERUBROLD, chất vải cotton mềm mát siêu cute",102.000₫,https://tiki.vn/cua-hang/thoitrangunisextp?source_screen=product_detail&source_engine=organic
https://tiki.vn/bo-quan-ao-nu-phoi-ren-p49563934.html?spid=96475322,BỘ QUẦN ÁO NỮ PHỐI REN,165.000₫,https://tiki.vn/cua-hang/thoi-trang-tina?source_screen=product_detail&source_engine=organic
https://tiki.vn/set-do-nu-timi-ao-phong-mix-quan-short-form-rong-unisex-p177996498.html?spid=177996523,Set Đồ Nữ Timi Áo Phông Mix Quần Short Form Rộng Unisex,107.000₫,https://tiki.vn/cua-hang/dam-yurin?source_screen=product_detail&source_engine=organic
https://tiki.vn/do-bo-cototn-nu-hoa-tiet-theu-quan-dai-sieu-re-dep-p67594700.html?spid=73864611,"Đồ bộ cototn nữ họa tiết thêu , quần dài - Siêu Rẻ Đẹp",99.000₫,https://tiki.vn/cua-hang/thoi-trang-tina?source_screen=product_detail&source_engine=organic
https://tiki.vn/do-bo-the-thao-nu-khoa-keo-in-chu-cao-cap-p68143083.html?spid=68143085,Đồ bộ thể thao nữ khóa kéo in chữ cao cấp,208.000₫,https://tiki.vn/cua-hang/thoi-trang-tina?source_screen=product_detail&source_engine=organic
https://tiki.vn/bo-do-nu-mac-nha-di-choi-nguyen-set-ao-va-quan-thun-cotton-thai-co-dan-thoai-mai-what-cll-p168273197.html?spid=193891646,Bộ đồ nữ mặc nhà đi chơi nguyên set áo và quần thun cotton Thái co dãn thoải mái What CLL,99.000₫,https://tiki.vn/cua-hang/thoi-trang-tina?source_screen=product_detail&source_engine=organic
https://tiki.vn/set-bo-do-nu-quan-ong-suong-rong-phoi-ao-theu-hoa-mac-o-nha-di-choi-duyen-dang-mau-moi-sieu-hot-co-bigsize-dep-xuat-sac-p253038386.html?spid=253038396,sét bộ đồ nữ quần ống suông rộng phối áo thêu hoa mặc ơ nhà đi chơi duyên dáng mẫu mới siêu hot có bigsize đẹp xuất sắc,254.150₫,https://tiki.vn/cua-hang/thoi-trang-tina?source_screen=product_detail&source_engine=organic
https://tiki.vn/set-do-bo-nu-quan-da-beo-phoi-ao-mau-nang-dong-p66580038.html?spid=66580056,Sét đồ bộ nữ quần da beo phối áo màu năng động,89.100₫,https://tiki.vn/cua-hang/thoi-trang-tina?source_screen=product_detail&source_engine=organic
https://tiki.vn/set-quan-short-ao-phong-bear-1983-ullzang-anh-that-co-san-p178577852.html?spid=178577870,"Set Quần Short + Áo Phông BEAR 1983 Ullzang (Ảnh thật/Có Sẵn), Set Đồ Nữ Đi Chơi Set Bộ Nữ Quần Short Ống Rộng Phong Cách Hàn Quốc Style Nhẹ Nhàng",90.000₫,https://tiki.vn/cua-hang/thoitrangtp?source_screen=product_detail&source_engine=organic
https://tiki.vn/set-bo-ao-gan-quan-lanh-ong-rong-2-mau-y-hinh-p271535453.html?spid=271535455,SÉT BỘ ÁO GÂN QUẦN LẠNH ỐNG RỘNG 2 MÀU Y HÌNH,145.000₫,https://tiki.vn/cua-hang/huong-nemo-style?source_screen=product_detail&source_engine=organic
https://tiki.vn/ao-tre-vai-phom-dai-rong-mac-giau-quan_ao-ho-vai-phom-rong-p221712488.html?spid=221712544,Áo trễ vai phom dài rộng mặc giấu quần_Áo hở vai phom rộng,239.000₫,https://tiki.vn/cua-hang/loan-store?source_screen=product_detail&source_engine=organic
https://tiki.vn/set-bo-ao-nhun-beo-mocking-phia-sau-ao-co-day-keo-quan-y-mau-mau-y-hinh-p275346376.html?spid=275346377,SET BỘ ÁO NHÚN BÈO MOCKING PHÍA SAU(ÁO CÓ DÂY KÉO)QUẦN Y MẪU MÀU Y HÌNH,185.000₫,https://tiki.vn/cua-hang/huong-nemo-style?source_screen=product_detail&source_engine=organic
